Artist,title,streams,lyrics,neg,neu,pos,compound
Shawn Mendes,Señorita ,2012778,  Chorus Camila Cabello I love it when you call me señorita I wish I could pretend I didnt need ya But every touch is oohlalala Its true lalala Ooh I should be runnin Ooh you keep me coming for ya  Verse 1 Shawn Mendes Land in Miami The air was hot from summer rain Sweat drippin off me Before I even knew her name lalala It felt like oohlalala yeah no Sapphire moonlight We danced for hours in the sand Tequila Sunrise Her body fit right in my hands lalala It felt like oohlalala yeah  Chorus Camila Cabello  Shawn Mendes Camila Cabello I love it when you call me señorita I wish I could pretend I didnt need ya But every touch is oohlalala Its true lalala Ooh I should be runnin Ooh you know I love it when you call me señorita I wish it wasnt so damn hard to leave ya But every touch is oohlalala Its true lalala Ooh I should be runnin Ooh you keep me coming for ya  Verse 2 Camila Cabello with Shawn Mendes Locked in the hotel Theres just some things that never change You say were just friends But friends dont know the way you taste lalala La la la Cause you know its been a long time coming Dont ya let me fall oh Ooh when your lips undress me hooked on your tongue Ooh love your kiss is deadly dont stop  Chorus Both Camila Cabello  Shawn Mendes I love it when you call me señorita I wish I could pretend I didnt need ya But every touch is oohlalala Its true lalala Ooh I should be runnin Ooh you know I love it when you call me señorita I wish it wasnt so damn hard to leave ya So damn hard to leave ya But every touch is oohlalala Its true lalala True lala Ooh I should be runnin Ooh you keep me coming for ya  Outro Both Shawn Mendes  Camila Cabello All along Ive been coming for ya For you And I hope it meant something to you Oh Call my name Ill be coming for ya Coming for you Coming for ya Coming for you For ya For ya Oh she loves it when I call For ya Ooh I should be runnin Ooh you keep me coming for ya  ,0.023,0.756,0.221,0.9979
Ed Sheeran,Beautiful People (feat. Khalid) ,1659136,  Intro Ed Sheeran We are we are we are  Verse 1 Ed Sheeran LA on a Saturday night in the summer Sundown and they all come out Lamborghinis and their rented Hummers The partys on so theyre headin downtown Round here Everybodys lookin for a come up And they wanna know what youre about Me in the middle with the one I love and Were just tryna figure everything out  PreChorus Ed Sheeran We dont fit in well cause we are just ourselves I could use some help gettin out of this conversation yeah You look stunning dear so dont ask that question here This is my only fear that we become  Chorus Ed Sheeran Beautiful people Drop top designer clothes Front row at fashion shows What dyou do and Who dyou know Inside the world of beautiful people Champagne and rolledup notes Prenups and broken homes Surrounded but still alone Lets leave the party  PostChorus Ed Sheeran Thats not who we are We are we are we are We are not beautiful Yeah thats not who we are We are we are we are We are not beautiful Beautiful  Verse 2 Khalid LA mmm Drove for hours last night and we made it nowhere Nowhere nowhere I see stars in your eyes when were halfway there All night Im not fazed by all them lights and flashin cameras Cause with my arms around you theres no need to care  PreChorus Khalid We dont fit in well we are just ourselves I could use some help gettin out of this conversation yeah You look stunning dear so dont ask that question here This is my only fear that we become  Chorus Ed Sheeran Beautiful people Drop top designer clothes Front row at fashion shows What dyou do and Who dyou know Inside the world of beautiful people Champagne and rolledup notes Prenups and broken homes Surrounded but still alone Lets leave the party  PostChorus Ed Sheeran Both Khalid Thats not who we are We are we are we are We are not beautiful yeah Yeah thats not who we are We are we are we are We are not beautiful Beautiful  Outro Ed Sheeran We are we are we are We are not beautiful  ,0.086,0.723,0.191,0.9949
Tones and I,Dance Monkey ,1626293,  Verse 1 They say Oh my God I see the way you shine Take your hands my dear and place them both in mine You know you stopped me dead while I was passing by And now I beg to see you dance just one more time  PreChorus Ooh I see you see you see you every time And oh my I I like your style You you make me make me make me wanna cry And now I beg to see you dance just one more time  Chorus So they say Dance for me dance for me dance for me ohohoh Ive never seen anybody do the things you do before They say Move for me move for me move for me ayyayyayy And when you’re done Ill make you do it all again  Verse 2 I said Oh my God I see you walking by Take my hands my dear and look me in my eyes Just like a monkey Ive been dancin’ my whole life But you just beg to see me dance just one more time  PreChorus Ooh I see you see you see you every time And oh my I I like your style You you make me make me make me wanna cry And now I beg to see you dance just one more time  Chorus So they say Dance for me dance for me dance for me ohohoh Ive never seen anybody do the things you do before They say Move for me move for me move for me ayyayyayy And when youre done Ill make you do it all again They say Dance for me dance for me dance for me ohohoh ohoh ohoh Ive never seen anybody do the things you do before They say Move for me move for me move for me ayyayyayy And when youre done Ill make you do it all again  Bridge Ooh ooh ooh ooh ooh Do it all again do it all again do it all again Ohoh ohoh oh Ooh ooh ooh ooh oohooh Do it all again do it all again do it all again Ooh ahah ahah  Chorus They say Dance for me dance for me dance for me ohohoh Ive never seen anybody do the things you do before They say Move for me move for me move for me ayyayyayy And when you’re done I’ll make you do it all again They say Dance for me dance for me dance for me ohohoh ohoh ohoh Ive never seen anybody do the things you do before They say Move for me move for me move for me ayyayyayy And when you’re done Ill make you do it all again All again  ,0.027,0.936,0.037,0.3612
Post Malone,Goodbyes (Feat. Young Thug) ,1576951,,none,none,none,none
Ed Sheeran,I Don't Care (with Justin Bieber) ,1194120,  Verse 1 Ed Sheeran Im at a party I dont wanna be at And I dont ever wear a suit and tie yeah Wonderin if I could sneak out the back Nobodys even lookin me in my eyes Then you take my hand Finish my drink say Shall we dance Hell yeah You know I love ya did I ever tell ya You make it better like that  PreChorus Ed Sheeran Dont think I fit in at this party Everyones got so much to say Yeah I always feel like Im nobody mmm Who wants to fit in anyway  Chorus Ed Sheeran Cause I dont care when Im with my baby yeah All the bad things disappear And youre making me feel like maybe I am somebody I can deal with the bad nights When Im with my baby yeah Ooh ooh ooh ooh ooh ooh Cause I dont care as long as you just hold me near You can take me anywhere And youre making me feel like Im loved by somebody I can deal with the bad nights When Im with my baby yeah Ooh ooh ooh ooh ooh ooh  Verse 2 Justin Bieber We at a party we dont wanna be at Tryna talk but we cant hear ourselves Read your lips Id rather kiss em right back With all these people all around Im crippled with anxiety But Im told its where Im sposed to be You know what Its kinda crazy cause I really dont mind When you make it better like that  PreChorus Justin Bieber Dont think we fit in at this party Everyones got so much to say oh yeah yeah When we walked in I said Im sorry mmm But now I think that we should stay  Chorus Ed Sheeran  Justin Bieber Cause I dont care when Im with my baby yeah All the bad things disappear Yeah youre making me feel like maybe I am somebody I can deal with the bad nights when Im with my baby yeah Ooh ooh ooh ooh ooh ooh Oh yeah yeah yeah Cause I dont care as long as you just hold me near You can take me anywhere And youre making me feel like Im loved by somebody I can deal with the bad nights when Im with my baby yeah Ooh ooh ooh ooh ooh ooh No  Bridge Justin Bieber  Ed Sheeran I dont like nobody but you its like youre the only one here I dont like nobody but you baby I dont care I dont like nobody but you I hate everyone here I dont like nobody but you baby yeah  Chorus Ed Sheeran  Justin Bieber Cause I dont care Dont care When Im with my baby yeah Oh yeah All the bad things disappear Disappear And youre making me feel like maybe I am somebody Maybe Im somebody I can deal with the bad nights With the bad nights When Im with my baby yeah Ooh ooh ooh ooh ooh ooh Oh yeah yeah yeah Cause I dont care as long as you just hold me near Me near You can take me anywhere Anywhere anywhere And youre making me feel like Im loved by somebody Im loved by somebody yeah yeah yeah I can deal with the bad nights When Im with my baby yeah Ooh ooh ooh ooh ooh ooh  ,0.125,0.677,0.198,0.9915
Lewis Capaldi,Someone You Loved ,1112384,  Verse 1 Im going under and this time I fear theres no one to save me This all or nothing really got a way of driving me crazy I need somebody to heal somebody to know Somebody to have somebody to hold Its easy to say but its never the same I guess I kinda liked the way you numbed all the pain  Chorus Now the day bleeds into nightfall And youre not here to get me through it all I let my guard down and then you pulled the rug I was getting kinda used to being someone you loved  Verse 2 Im going under and this time I fear theres no one to turn to This all or nothing way of loving got me sleeping without you Now I need somebody to know somebody to heal Somebody to have just to know how it feels Its easy to say but its never the same I guess I kinda like the way you help me escape  Chorus Now the day bleeds into nightfall And youre not here to get me through it all I let my guard down and then you pulled the rug I was getting kinda used to being someone you loved  Bridge And I tend to close my eyes when it hurts sometimes I fall into your arms Ill be safe in your sound till I come back around  Chorus For now the day bleeds into nightfall And youre not here to get me through it all I let my guard down and then you pulled the rug I was getting kinda used to being someone you loved But now the day bleeds into nightfall And youre not here to get me through it all I let my guard down and then you pulled the rug I was getting kinda used to being someone you loved I let my guard down and then you pulled the rug I was getting kinda used to being someone you loved  ,0.076,0.787,0.138,0.9788
MEDUZA,Piece Of Your Heart ,1052269,  Verse Show me a piece of your heart a piece of your love Im calling you up to gettin down down down The way that we touch is never enough Im turning you up to gettin down down Show me a piece of your heart a piece of your love Im calling you up to gettin down down down The way that we touch is never enough Im turning you up to gettin down down down  Break What Sorry just quickly What if its da da da uh uh Da da da uh uh Down down down  Chorus Uh da da da uh uh Da da da uh uh Da da da uh uh Da da da Uh da da da uh uh Da da da uh uh Da da da uh uh Down down down  PostChorus Show me a piece of you show me a part of you Ill be what you want And if its physical keep it subliminal Show me what you want Show me a piece of you show me a part of you Ill be what you want And if its physical keep it subliminal Show me what you want  Verse Show me a piece of your heart a piece of your love Im calling you up to gettin down down down The way that we touch is never enough Im turning you up to gettin down down down  Interlude Da da da uh uh Da da da uh uh Da da da uh uh Down down down  Chorus Uh da da da uh uh Da da da uh uh Da da da uh uh Da da da Uh da da da uh uh Da da da uh uh Da da da uh uh Down down down  PostChorus Show me a piece of you show me a part of you Ill be what you want And if its physical keep it subliminal Show me what you want  ,0.004,0.933,0.063,0.9442
Lil Nas X,Old Town Road (feat. Billy Ray Cyrus) - Remix ,1006944,  Intro Billy Ray Cyrus Oh ohoh Oh  Refrain Billy Ray Cyrus Yeah Im gonna take my horse to the old town road Im gonna ride til I cant no more Im gonna take my horse to the old town road Im gonna ride til I cant no more Kio Kio  Verse 1 Lil Nas X I got the horses in the back Horse tack is attached Hat is matte black Got the boots thats black to match Ridin on a horse ha You can whip your Porsche I been in the valley You aint been up off that porch now  Chorus Lil Nas X Cant nobody tell me nothin You cant tell me nothin Cant nobody tell me nothin You cant tell me nothin  Verse 2 Lil Nas X Ridin on a tractor Lean all in my bladder Cheated on my baby You can go and ask her My life is a movie Bull ridin and boobies Cowboy hat from Gucci Wrangler on my booty  Chorus Lil Nas X Cant nobody tell me nothin You cant tell me nothin Cant nobody tell me nothin You cant tell me nothin  Refrain Lil Nas X Yeah Im gonna take my horse to the old town road Im gonna ride til I cant no more Im gonna take my horse to the old town road Im gonna ride til I cant no more  Verse 3 Billy Ray Cyrus Hat down cross town livin like a rockstar Spent a lot of money on my brand new guitar Babys got a habit diamond rings and Fendi sports bras Ridin down Rodeo in my Maserati sports car Got no stress Ive been through all that Im like a Marlboro Man so I kick on back Wish I could roll on back to that old town road I wanna ride til I cant no more  Outro Lil Nas X  Billy Ray Cyrus Yeah Im gonna take my horse to the old town road Im gonna ride til I cant no more Im gonna take my horse to the old town road Im gonna ride til I cant no more  ,0.017,0.886,0.097,0.9643
Ed Sheeran,Antisocial (with Travis Scott) ,1004568,  Intro Grandmaster Flash All you cool people you better leave now Cause its about to happen  Verse 1 Ed Sheeran  Travis Scott Friday night and Im ridin solo Yeah When I touch down keep it on the lowlow Its lit I dont mess with your energy Nah no photos Ayy So antisocial but I dont care Ayy Dont give a damn Im gonna smoke here Ayy pop it Got a bottle in my hand bring more though Ayy pop it pop it Got my hat low dont talk to me Straight up  PreChorus Ed Sheeran  Travis Scott Ive been down give me some space You dont know whats in my brain Music loud easin my pain Yeah yeah yeah yeah  Chorus Ed Sheeran  Travis Scott Dont touch me dont touch me Dont touch me I came to vibe yeah On something on something On something I wanna riot Dont touch me dont touch me Dont touch me I came to vibe yeah Wont let nothing come in between me and the night Straight up Dont touch me dont touch me Dont touch me I came to vibe yeah On something on something On something I wanna riot Dont touch me dont touch me Dont touch me I came to vibe yeah Wont let nothing come in between me and the night yeah  Verse 2 Travis Scott  Ed Sheeran I need room I need room Where you standin way too close You might catch fumes might catch fumes When I zoom Pew when I zoom Pass out wake up by myself right past noon Right past noon then Im doomed Occupied and movin dolo Ooh yeah Hennessys drownin all of my issues Drown Right before I leave she give me more than just a miss you Yeah That thing got more back just like my engine I can hit it In the boy Seen a vision in the boy then we committed Its lit  PreChorus Travis Scott Ive been lost out inner space You left me right in my place I put you down on my name Yeah yeah yeah yeah  Chorus Ed Sheeran  Travis Scott Dont touch me dont touch me Dont touch me I came to vibe yeah On something on something On something I wanna riot Dont touch me dont touch me Dont touch me I came to vibe yeah Wont let nothing come in between me and the night Straight up Dont touch me dont touch me Dont touch me I came to vibe yeah On something on something On something I wanna riot Dont touch me dont touch me Dont touch me I came to vibe yeah Wont let nothing come in between me and the night  Outro Travis Scott Dont touch me yeah  ,0.093,0.763,0.145,0.9665
Sam Smith,How Do You Sleep? ,985334,  Verse 1 Im done hatin myself for feelin Im done cryin myself awake I gotta leave and start the healin But when you move like that I just wanna stay  PreChorus What have I become now Lookin through your phone now Oh now love to you is just a game Look what I have done now Dialling up the numbers on you I dont want my heart to break  Chorus Baby how do you sleep when you lie to me All that shame and all that danger Im hopin that my love will keep you up tonight Baby how do you sleep when you lie to me All that fear and all that pressure Im hopin that my love will keep you up tonight  PostChorus Tell me how do you— Love will keep you up tonight Tell me how do you—  Verse 2 Oh no how did I manage to lose me I am not this desperate not this crazy Theres no way Im stickin round to find out I wont lose like that I wont lose myself  PreChorus Look what I have done Done Diallin up the numbers on you I dont want my heart to break  Chorus Baby how do you sleep when you lie to me All that shame and all that danger Im hopin that my love will keep you up tonight Baby how do you sleep when you lie to me All that fear and all that pressure Im hopin that my love will keep you up tonight  PostChorus Tell me how do you— Yeah yeah yeah Love will keep you up tonight Tell me how do you— Oh love will keep you up tonight  Chorus Baby how do you sleep when you lie to me All that shame and all that danger Im hopin that my love will keep you up tonight Baby how do you sleep when you lie to me Oh All that fear and all that pressure Oh Im hopin that my love will keep you up tonight Tell me how do you—  ,0.128,0.726,0.146,0.9319
Drake,Money In The Grave (Drake ft. Rick Ross) ,984076,,none,none,none,none
Billie Eilish,bad guy ,958496,  Verse 1 White shirt now red my bloody nose Sleepin youre on your tippy toes Creepin around like no one knows Think youre so criminal Bruises on both my knees for you Dont say thank you or please I do what I want when Im wanting to My soul So cynical  Chorus So youre a tough guy Like it really rough guy Just cant get enough guy Chest always so puffed guy Im that bad type Make your mama sad type Make your girlfriend mad tight Might seduce your dad type Im the bad guy Duh  PostChorus Im the bad guy  Verse 2 I like it when you take control Even if you know that you dont Own me Ill let you play the role Ill be your animal My mommy likes to sing along with me But she wont sing this song If she reads all the lyrics Shell pity the men I know  Chorus So youre a tough guy Like it really rough guy Just cant get enough guy Chest always so puffed guy Im that bad type Make your mama sad type Make your girlfriend mad tight Might seduce your dad type Im the bad guy Duh  PostChorus Im the bad guy duh Im only good at bein bad bad  Bridge I like when you get mad I guess Im pretty glad that youre alone You said shes scared of me I mean I dont see what she sees But maybe its cause Im wearing your cologne  Outro Im a bad guy Im Im a bad guy Bad guy bad guy Im a bad  ,0.262,0.646,0.092,-0.9954
Y2K,Lalala ,949635,  Intro bbno  Y2K Did I really just forget that melody Naw nana bananana nanananananana Nana ahah Alright dada dadadada  Chorus bbno When I popped off then your girl gave me just a little bit of lockjaw Baby so cold he from the north he from the Canada Bankroll so low I got nothing else that I can withdraw Ran out the door I shine my wrist it go like shashasha shashasha I got your bitch singing lalalala lalala I shine my wrist it go like shashasha shashasha I got your bitch singing lalalala lalala How I stride like that  Verse 1 bbno Amex no cap eight hundred score They wonder how How I guap like that I rap my lyrics when I perform They wonder how How I stride like that Married to the grind I brought my ring Im corny but your girly want the dick Modest with my jewels but check the bank Finally got the money say my thanks  Chorus bbno When I popped off then your girl gave me just a little bit of lockjaw Baby so cold he from the north he from the Canada Bankroll so low I got nothing else that I can withdraw Ran out the door I shine my wrist it go like shashasha shashasha I got your bitch singing lalalala lalala I shine my wrist it go like shashasha shashasha I got your bitch singing lalalala lalala How I stride like that  Verse 2 bbno Haha Im at the bank again They wonder how How I guap like that Pink whip with flames all on the side They wonder how How I stride like that Got that Gucci on my body now she tryna pipe me woo Popped a Lucy looseygoosey sussy boy I keep you cool Got the paper went to school Be careful who you callin fool ayy ha ayy  Chorus bbno When I popped off then your girl gave me just a little bit of lockjaw Baby so cold he from the north he from the Canada Bankroll so low I got nothing else that I can withdraw Ran out the door I shine my wrist it go like shashasha shashasha I got your bitch singing lalalala lalala I shine my wrist it go like shashasha shashasha I got your bitch singing lalalala lalala How I stride like that  ,0.108,0.748,0.144,0.8579
Ali Gatie,It's You ,937261,  Chorus Its you its always you If Im ever gonna fall in love I know its gon be you Its you its always you Met a lot of people but nobody feels like you So please dont break my heart dont tear me apart I know how it starts trust me Ive been broken before Dont break me again I am delicate Please dont break my heart trust me Ive been broken before  Verse 1 Ive been broken yeah I know how it feels To be open and then find out your love isnt real Im still hurting yeah Im hurting inside Im so scared to fall in love but if its you then Ill try  Chorus Its you its always you If Im ever gonna fall in love I know its gon be you Its you its always you Met a lot of people but nobody feels like you So please dont break my heart dont tear me apart I know how it starts trust me Ive been broken before Dont break me again I am delicate Please dont break my heart trust me Ive been broken before  Verse 2 I know Im not the best at choosing lovers Oh We both know my past speaks for itself For itself If you dont think that were right for each other Baby no Then please dont let history repeat itself Cause I want you yeah I want you yeah Theres nothing else I want Cause I want you yeah I want you yeah And youre the only thing I want  Chorus Its you its always you If Im ever gonna fall in love I know its gon be you Its you its always you Met a lot of people but nobody feels like you So please dont break my heart dont tear me apart I know how it starts trust me Ive been broken before Dont break me again I am delicate Please dont break my heart trust me Ive been broken before  Outro Baby I want you baby I want you Baby I want you baby I want you Baby I want you baby I want you You you cause I want you Baby I want you baby I want you Baby I want you baby I want you Baby I want you baby I want you You you  ,0.096,0.618,0.287,0.9973
Lil Nas X,Panini ,932838,  Intro Nessly DDDaytrip took it to ten Hey  Verse 1 Ayy Panini dont you be a meanie Thought you wanted me to go up Why you tryna keep me teeny I Its a dream he wished it on a genie I got fans finally aint you wanting them to see me I  Refrain I thought you want this for my life for my life Said you wanted to see me thrive you lied  Chorus Just say to me what you want from me Just say to me what you want from me  Verse 2 Ayy Panini dont you be a meanie Thought you wanted me to go up Why you tryna keep me teeny now Now they need me number one on streaming Oh yeah you used to love me So what happened whats the meaning I  Refrain I thought you want this for my life for my life Said you wanted to see me thrive you lied  Verse 3 Now when its all done I get the upper hand I need a big Benz not another fan But I still want you as a fan Ima need to sit down dont mean to make demands But I need you to  Chorus Say to me what you want from me Just say to me what you want from me  Outro Nessly DDDaytrip took it to ten Hey  ,0.04,0.859,0.101,0.8332
